Statement,Type
"This Collective Bargaining Agreement (Agreement), entered into by and between the City of Tulsa, Oklahoma, hereinafter referred to as ""Employer,"" and members of the bargaining unit of the City of Tulsa Fire Department acting by and through its duly authorized bargaining agent, Local No. 176, International Association of Firefighters, hereinafter referred to as ""Union,"" has as its purposes the promotion of harmonious relations between the Employer and the Union and the establishment of an equitable and peaceful procedure for the resolution of differences; to insure the well being of said Employees, covered by this Agreement; and the efficient and economical operation of the Tulsa Fire Department; and the establishment of rates of pay, hours of work, and other conditions of employment.",Preamble
"As a preamble to this Agreement, the Parties agree to the following",Preamble
The Council of Trustees’ Associations (CTA) and the Canadian Union of Public Employees (CUPE) agree to establish a joint Central Labour Relations Committee (Committee) to promote and facilitate communication between rounds of bargaining on issues of joint interest.,Preamble
"The Government of the People’s Republic of China (“China”) and the Government of the Republic of Chile (“Chile”), hereinafter referred to as “the Parties”; Committed to strengthening the special bonds of friendship and cooperation between their countries; Sharing the belief that a free trade agreement shall produce mutual benefits to each Party and contribute to the expansion and development of world trade under the multilateral trading system embodied in the Marrakesh Agreement Establishing the World Trade Organization (“the WTO Agreement”); Building on their respective rights and obligations under the WTO Agreement and other multilateral, regional and bilateral instruments of cooperation; Supporting the wider liberalization process in the Asia-Pacific Economic Cooperation (APEC) and in particular the efforts of all APEC economies to meet the Bogor goals of free and open trade and the actions subscribed on the Osaka Action Agenda; Recognizing the contribution, guidance and meaningful reference of the APEC Best Practices for Regional Trade Arrangements (RTAs), Free Trade Agreements (FTAs), and other Preferential Arrangements; Resolved to promote reciprocal trade through the establishment of clear and mutually advantageous trade rules and the avoidance of trade barriers; Recognizing that this Agreement should be implemented with a view toward raising the standard of living, creating new job opportunities, and promoting sustainable development in a manner consistent with environmental protection and conservation; and Committed to promoting the public welfare within each of their countries",Preamble
"The licenses for most software are designed to take away your freedom to share and change it. By contrast, the GNU General Public License is intended to guarantee your freedom to share and change free software--to make sure the software is free for all its users. This General Public License applies to most of the Free Software Foundation's software and to any other program whose authors commit to using it. (Some other Free Software Foundation software is covered by the GNU Library General Public License instead.) You can apply it to your programs, too. When we speak of free software, we are referring to freedom, not price. Our General Public Licenses are designed to make sure that you have the freedom to distribute copies of free software (and charge for this service if you wish), that you receive source code or can get it if you want it, that you can change the software or use pieces of it in new free programs; and that you know you can do these things. To protect your rights, we need to make restrictions that forbid anyone to deny you these rights or to ask you to surrender the rights. These restrictions translate to certain responsibilities for you if you distribute copies of the software, or if you modify it. For example, if you distribute copies of such a program, whether gratis or for a fee, you must give the recipients all the rights that you have.",Preamble
"Deliver to the Administrative Agent and each Lender, in form and detail satisfactory to the Administrative Agent and the Required Lenders:",Other
"Provider represents that it is authorized to bind to the terms of this Agreement, including confidentiality and destruction of Student Data and any portion thereof contained therein, all related or associated institutions, individuals, employees or contractors who may have access to the Student Data and/or any portion thereof, or may own, lease or control equipment or facilities of any kind where the Student Data and portion thereof stored, maintained or used in any way.",Other
The obligations of the Lenders to make Loans and of the Issuing Bank to issue Letters of Credit hereunder shall not become effective until the date on which each of the following conditions is satisfied (or waived in accordance with Section 9.02):,Other
" For the purposes of this Contract, the “affirmative vote of a majority of the outstanding shares” of a Fund means the affirmative vote, at a duly called and held meeting of shareholders of the respective Fund, (a) of the holders of 67% or more of the shares of the Fund present (in person or by proxy) and entitled to vote at the meeting, if the holders of more than 50% of the outstanding shares of the Fund entitled to vote at the meeting are present in person or by proxy or (b) of the holders of more than 50% of the outstanding shares of the Fund entitled to vote at the meeting, whichever is less.",Other
"“Annual Base Salary” means the annualized amount of Executive’s rate of base salary in effect immediately before the Change in Control or immediately before the date of Termination, whichever is greater.",Other
"References to “agent” shall mean any person who is or was a director, officer, or employee of the Company or a Subsidiary of the Company or other person authorized by the Company to act for the Company, to include such person serving in such capacity as a director, officer, employee, fiduciary or other official of another corporation, partnership, limited liability company, joint venture, trust or other enterprise at the request of, for the convenience of, or to represent the interests of the Company or a Subsidiary of the Company.",Other
" In the event that either Party seeks to terminate this DPA, they may do so by mutual written consent so long as the Service Agreement has lapsed or has been terminated. Either party may terminate this DPA and any service agreement or contract if the other party breaches any terms of this DPA.",Other
" The Company shall pay, and shall cause each of its Subsidiaries to pay, prior to delinquency, all material taxes, assessments, and governmental levies except such as are contested in good faith and by appropriate proceedings or where the failure to effect such payment is not adverse in any material respect to the Holders of the Notes.",Other
"“Subsidiary” means a corporation, partnership, limited liability company or other entity, which is owned or controlled, directly or indirectly, by the Company, the Operating Partnership or one or more other Subsidiaries of the Company or the Operating Partnership.",Other
"“Applicable Time” means the date of this Agreement, each Representation Date, the date on which a Placement Notice is given, any date on which Placement Shares are sold hereunder and each Settlement Date, or such other time as agreed to by the Company and the Agent.",Other